site,title,company_name,city,state,job_type,interval,min_amount,max_amount,job_url,description
zip_recruiter,Software Developer (Hybrid),Securian Financial Group,Rochester,MN,fulltime,yearly,0.0,0.0,https://securianfinancialgroup.thejobnetwork.com/Job/572852459?etd=LAFFER2UEHPRAUSQQPPXYFWLU2JCRQSYH57BCY2Y77KJQJLPDYIQS7HRGQJBW6KBUNSNNRUPEII6VAURJQBO4HOBHP6MA7OKXLO4FTQXLNMUODN647UXRQ46B2PP7NDECDPG3ZZYCJFEFM3IBYVGBMWDCI%3d%3d%3d%3d%3d%3d&zcip=[click_id],As a Software Developer you will work among professionals who are responsible for providing high quality solutions that support the purchase and use of Affinity products. You will leverage ...
zip_recruiter,Software Engineer I (Hybrid),Raytheon,Aurora,CO,fulltime,yearly,0.0,0.0,https://jsv3.recruitics.com/redirect?rx_cid=3426&rx_jobId=01648755&rx_url=https%3A%2F%2Fcareers.rtx.com%2Fglobal%2Fen%2Fjob%2F01648755%3Frx_campaign%3Dziprecruiter145%26rx_ch%3Djobp4p%26rx_group%3D275313%26rx_job%3D01648755%26rx_medium%3Dcpc%26rx_r%3Dnone%26rx_source%3Dziprecruiter%26rx_ts%3D20230903T060403Z%26rx_vp%3Dcpc&rx_p=[click_id],"Our highly skilled software engineers develop new technologies that advance our Nation's defense capabilities. In this position, you will be part of a team responsible for the design, development ..."
zip_recruiter,Cloud Software Engineer III-Shake Alert,EarthScope Consortium,Remote,OR,fulltime,yearly,86000.0,108000.0,https://www.click2apply.net/gJ8AEofpa1NOmUlQyH6eLP?cid=[click_id],"Job Title : Cloud Software Engineer III Department : Data Services Reports to: Engineering Manager IV Employment Status : Full-Time FLSA Status : Exempt Location: Remote, United States Travel ..."
indeed,Data Engineer,Sanametrix,Remote,,fulltime,yearly,120080.0,110656.0,https://www.indeed.com/viewjob?jk=6116c05f42022336,"***US Citzenship is Required****** Sanametrix, Inc. is a fast-growing small business headquartered in Arlington, VA. We are dedicated to providing federal agencies with legendary customer service and focused solutions for their business and technology needs. This role is responsible for building data pipelines for transferring data from source systems (virtual machines, Microsoft SQL Server) into AWS Cloud using AWS Native Tools. This resource has strong data modeling and scripting experience and has a strong knowledge of AWS Data Services. Responsibilities: Perform data processing, algorithm / structures, pipeline orchestration, data quality, governance, discovery Work with structured and unstructured data, blob data Develop and work with APIs Collect and organize data using data warehousing technique and file storage technologies • Perform ELT and ETL processes Gather data requirements Develop and maintain scalable data pipelines and build out new API integrations to support continuing increases in data volume and complexity. Collaborate with analytics and business teams to improve data models that feed business intelligence tools, increase data accessibility, and foster data-driven decision making across the organization. Implement processes and systems to monitor data quality, to ensure production data accuracy, and ensure key stakeholder and business process access. Write unit/integration tests, contribute to engineering wiki, and documents. Perform data analysis required to troubleshoot data related issues and assist in the resolution of data issues. Work closely with a team of front-end and back-end engineers, product managers, and analysts. Design data integrations and data quality framework based on established requirements. Qualifications & Skills: Scripting • SQL • Python • Spark • Linux / shell scripting Services / Tools (six or more) S3 Lambda Redshift Lake Formation Glue ETL Kinesis DMS Glue catalog/Crawlers Git Jira Airflow /Orchestration Education, Experience, and Licensing Requirements: BS or MS degree in Computer Science or a related technical field 4+ years of Python or Java development experience 4+ years of SQL or NoSQL experience 4+ years of experience with schema design and dimensional data modeling Ability in managing and communicating data warehouse plans to internal clients Experience designing, building, and maintaining data processing systems AWS Certified is preferred Job Type: Full-time Pay: $110,656.51 - $120,080.95 per year Benefits: 401(k) 401(k) matching Dental insurance Employee assistance program Flexible schedule Flexible spending account Health insurance Health savings account Life insurance Paid time off Professional development assistance Tuition reimbursement Compensation package: Yearly pay Experience level: 4 years Schedule: 8 hour shift Day shift Monday to Friday Experience: Informatica: 4 years (Preferred) SQL: 4 years (Required) Data warehouse: 4 years (Preferred) Work Location: Remote"
indeed,Test Engineer,Interactive Resources LLC,Remote,,fulltime,hourly,44.0,40.0,https://www.indeed.com/viewjob?jk=4f1995a20c86cf65,"Data Engineer/Testing Engineer/Data Testing Engineer Join our team today on this EXCITING contract job opportunity with a FANTASTIC Health Plan/Insurance industry client company! **FULL DETAILS will be provided over a phone call to discuss!** SUMMARY: The hiring manager and team is seeking a “jack of all trades” Data Analysis & Testing Engineer to assist in the data mapping processes from Medicare Claims vendors into the enterprise data warehouse. The team currently works with in the UAT checks, end-user testing, implementations, statistical analysis, data engineering, and data analysis spaces. Integrates data from multiple data sources or functional areas, ensures data accuracy and integrity, and updates data as needed to ensure data warehouse accuracy that is used for internal and external Medicare reporting. Consults with users or decision makers to identify data sources, required data elements, and/or data validation standards. Collects data to identify and performs root cause analysis of issues or problems and share with leadership while also proposing solutions. Manages multiple projects required for vendor integration needs while maintaining deliverable timelines, identifying potential enhancements to workflows and processes. Utilizes Advanced Excel, proficient with SAS/SQL – capable of creating queries, and able to clearly explain results found. Develop analytics to support and lead data integration review sessions with key internal stakeholders that identify on time, at risk, and potential efficiency opportunities. DETAILS: This position is FULLY remote and open to those located in the state of Arkansas, Florida, Georgia, Illinois, Kansas, Louisiana, Minnesota, Oklahoma, South Carolina, Tennessee, Texas, or Wisconsin. (Will need to adhere to a working shift based on central time zone*) MUST have a completed Bachelor’s Degree. A higher level of completed education is a big plus! This is a contract job opportunity through to January of 2024 (with the possibility of conversion or extension)! Starting pay is $40.00/hour-$44.00/hour (based on experience level). REQUIREMENTS: MUST have a completed Bachelor’s Degree. A higher level of completed education is a big plus! MUST have experience working with Data within the Medicare/Medicaid product-line space- Related data engineering work related to Medicare Pharmacy claims, includes PDE claims, Part D vs B claims, Rejection claims, etc. Documentation substantiating incumbent’s analysis experience may be required. MUST have 1-5 years+ of demonstrated experience in the application of data analysis or data management and analysis tools including but not limited to, SAS, SQL, AQT. MUST have experience with other PC-based software products including Microsoft Office suite of products - Excel, Word, and PowerPoint. MUST interview with a hiring manager in order to receive a job offer and MUST be willing/able to submit to background screening and drug screening if job offer is accepted! Interactive Resources (iR) was built to provide a personalized approach to solving client and candidate needs while building sustaining relationships. In a world where technology advances by the minute, relationships are the variable that cannot be substituted with software. Founded in 2006 in Jacksonville, Florida, iR has grown year over year expanding across the United States. iR was founded on the principles of Honesty, Trust, and Dedication. We take pride in the relationships we have built and continue to build, and we are dedicated to delivering the superior results that our clients and candidates come to expect and deserve. We love what we do! Relationships – Talent – Results Job Type: Full-time Pay: $40.00 - $44.00 per hour Experience level: 10 years 11+ years 3 years 4 years 5 years 6 years 7 years 8 years 9 years Schedule: Day shift Monday to Friday Education: Bachelor's (Required) Experience: SAS Programming: 2 years (Required) Medicaid Claims Data: 1 year (Required) Data warehouse: 1 year (Required) Data Integration: 1 year (Required) Work Location: Remote"
indeed,Data Engineer,Global Staffing Services,Remote,,fulltime,yearly,115000.0,80000.0,https://www.indeed.com/viewjob?jk=a4c999dcad7d756c,"Central Turf & Irrigation Supply is a leading wholesale distributor for landscape supplies--with 60 locations.U.S. and Canada. We are a fast-growing company in a highly competitive industry. We are looking for a talented business data analyst to help support our team with data analytics to translate data into actionable information that will affect company revenue and operational growth. Working directly with our executives and directors, our ideal candidate should be a results-driven team player with strong analytical skills. The candidate should be detail oriented with excellent organizational and time management skills to multi-task on several projects concurrently. You should be able to function independently and as part of a team within a fast-paced, high volume, changing environment. You must be able to develop and meet deadlines. In addition, you will need to communicate effectively with cross-functional teams and with all levels of our team across the organization while providing a high level of customer service to the internal stakeholders. Responsibilities Assists in designing, developing, and maintaining databases, views, reports, and dashboards in Phocus BI Software.Manage rebate and regulatory reporting and analysis with Phocus Rebates BI Software.Function as technical expert as it relates to the data and data analytics. Create, edit, and update dashboards and reports to drive efficient operations. Engage with internal staff to translate data needs into actionable analytic specifications. Produce clear, concise, and on-time reports that highlight data, trends and include charts and analysis of the data to help drive business decisions. Collaborate with executives, directors, and end users to refine and implement data product requirements and incorporate feedback on an ongoing basis. Perform data analysis in support of ad-hoc and standing organizational requests. Required Qualifications Bachelor's degree in data or computer science, statistics, or information systems (or equivalent experience)Demonstrated experience in SQL scripting and data manipulation.Experience with Phocus Bl and Infor SXe/CSD preferred.Data VisualizationECBA certification (Preferred)PMI PBA Certification (Preferred)Works with large data sets Experience in wholesale distribution and green industry preferred.Knowledge of relational databases, Progress is a plusProficient in Microsoft Excel.Demonstrated ability to work in a fast-paced, flexible environment.Ability to manage multiple projects and work within allotted deadlines while maintaining a positive and energetic demeanor. Perks & BenefitsHealth InsurancePaid time off401K and Profit-SharingJob Type: Full-timeResponsibilities:- Collaborate with cross-functional teams to define and implement innovative user experiences for software applications- Conduct user research and gather feedback to inform design decisions- Create wireframes, prototypes, and visual designs that effectively communicate the desired user experience- Work closely with developers to ensure the design vision is implemented accurately- Conduct usability testing and iterate on designs based on user feedback- Stay up-to-date with industry trends and best practices in user experience design Experience:- Proven experience as a User Experience Designer or similar role- Strong portfolio showcasing your design skills and ability to solve complex problems- Proficiency in design tools such as Adobe Creative Suite, Sketch, or Figma- Knowledge of front-end development technologies such as HTML, CSS, and JavaScript- Familiarity with version control systems like SVN or Git- Experience working in an Agile development environment- Familiarity with application development frameworks such as .NET or Azure- Knowledge of programming languages like C or SQL is a plus We offer competitive compensation and benefits packages, including:- Health insurance coverage- Retirement plan options- Paid time off and holidays If you are a creative problem solver with a passion for creating exceptional user experiences, we would love to hear from you. Apply now to join our talented team of User Experience Designers! Job Type: Full-time Pay: $80,000.00 - $115,000.00 per year Benefits: 401(k) Dental insurance Health insurance Paid time off Schedule: 8 hour shift Work Location: Remote"
indeed,Data Engineer,Brooksource,Remote,,contract,hourly,45.0,44.0,https://www.indeed.com/viewjob?jk=4bcb1d3cad027dbc,"Data Engineer / DBT Developer Remote 1 year contract $45/hr Project Overview: Our insurance, banking and investment client is looking to bring on a Data Engineer / DBT developer to help out with a data integration project. As the DBT developer you will utilize contemporary data technologies such as Snowflake, DBT, container-based APIs, Python, and Kafka. Their objective is to construct data pipelines, using these technologies, that empower the business to create and execute financial models based on various inputs. Additionally, they'll establish reporting functionalities for the outcomes of these models to report back to c-suite leadership. Responsibilities: Engages in the complete data engineering life cycle, encompassing tasks like analysis, solution design, data pipeline development, testing, deployment, scheduling, and providing support in production under the guidance of senior team members. Contributes to the execution of technical solutions for data reporting and analytics systems. Aids in the creation of test scripts to ensure data integrity and functional correctness. Evaluates the effectiveness of existing test scripts. Displays a grasp of best practices in IT Change and Release Management. Executes data pipeline code deployment with the support of senior team members. Takes part in design and code review sessions. Skillset: 2 years of data engineering, data analysis or software development experience implementing data solutions Working Experience in SQL and Relational Databases DBT development experience Knowledge or experience of Snaplogic is a plus Snowflake experience is a plus What’s in it for you? Working at one of the largest banking entities in America Working out of the Head Quarters locations Health, dental, and vision benefits Eight Eleven Group (Brooksource) provides equal employment opportunities (EEO) to all employees and applicants for employment without regard to race, color, religion, national origin, age, sex, citizenship, disability, genetic information, sexual orientation, gender identity, marital status, amnesty or status as a covered veteran in accordance with applicable federal, state, and local laws. Job Types: Contract, Permanent Pay: $44.00 - $45.00 per hour Benefits: 401(k) Dental insurance Health insurance Health savings account Vision insurance Work Location: Remote"
indeed,Data Engineer,Brooksource,Remote,,fulltime,hourly,65.0,60.0,https://www.indeed.com/viewjob?jk=63c4e59a6febe0e0,"Data Engineer Brooksource Fortune 50 Health Insurance Client Remote Do you thrive on working on the cutting edge? Working with innovators in the early stages of ideas, products, or platforms? We may have the position for you! Our client is looking for a well rounded Data Engineer/Architect to join their IT Medicare team which supports one of the organization's largest Provider applications. This application stores all of the Medicare Actuaries - Pricing, Analysis and Claims data for their insurance plans. This data is currently housed in SQL Server across over 600 widely spread tables, and your job will be to synchronize those tables while also understanding the dependencies of other tables and the application it connects to during the consolidation process. Responsibilities: The Lead Data Engineer designs, builds, and maintains data processing architectures and solutions enabling the efficient conversion of structured and unstructured data to insights at enterprise scale. Ingests data from internal and external sources utilizing cloud native platforms and software development best practices and patterns Develops software tools that leverage artificial intelligence, machine learning, and big-data techniques to cleanse, organize, and transform data into insights and actions that enables our client to better serve its members Advises executives to develop functional strategies (often segment specific) on matters of significance Exercises independent judgment and decision making on complex issues regarding job duties and related tasks, and works under minimal supervision Uses independent judgment requiring analysis of variable factors and determining the best course of action Develops tooling and infrastructure to efficiently integrate with data platforms using support services like data registries (ex. OpenMetadata, Atlan, Alation), Git, DBT, Orchestration tools like Airflow/Prefect, and query federation tools like Starburst - at scale, across multiple clouds, geographies and deployment types.This includes CI/CD processes, test frameworks for pipelines and data quality, and infrastructure-as-code tooling Partners with the client's Product, enterprise architecture and engineering teams to provide leadership in developing the long-term vision and requirements Establishes conventions and creates new APIs for telemetry, debug, feature and audit event log data, and evolves them as the product and underlying services change. Qualifications: 8 or more years of progressive IT experience as a senior Data Engineer in large IT projects Strong experience building scalable data platforms and data engineering Extensive background working with SQL Server Experience providing technical leadership on large projects - ETL frameworks, metrics stores, infrastructure management, data security. Experience building, shipping and operating reliable multi-geo data pipelines at scale Experience working with and operating workflow or orchestration frameworks, including open source tools like Airflow and DBT is preferred Experience with large-scale messaging systems like Kafka is preferred Excellent cross-functional and communication skills, consensus builder Passion for data engineering and for enabling others by making their data easier to access Can connect dots among difference pieces of information gained from multiple sources Experience troubleshooting software applications that involve APIs, databases, and frontend ABOUT EIGHT ELEVEN: At Eight Eleven, our business is people. Relationships are at the center of what we do. A successful partnership is only as strong as the relationship built. We’re your trusted partner for IT hiring, recruiting and staffing needs. For over 16 years, Eight Eleven has established and maintained relationships that are designed to meet your IT staffing needs. Whether it’s contract, contract-to-hire, or permanent placement work, we customize our search based upon your company's unique initiatives, culture and technologies. With our national team of recruiters placed at 21 major hubs around the nation, Eight Eleven finds the people best-suited for your business. When you work with us, we work with you. That’s the Eight Eleven promise. Eight Eleven Group provides equal employment opportunities (EEO) to all employees and applicants for employment without regard to race, color, religion, national origin, age, sex, citizenship, disability, genetic information, gender, sexual orientation, gender identity, marital status, amnesty or status as a covered veteran in accordance with applicable federal, state, and local laws. Job Types: Full-time, Contract Pay: $60.00 - $65.00 per hour Expected hours: No more than 40 per week Benefits: Dental insurance Health insurance Vision insurance Compensation package: Hourly pay Weekly pay Experience level: 5 years 6 years 7 years Schedule: Monday to Friday Experience: SQL: 5 years (Required) ETL: 5 years (Required) Work Location: Remote"
indeed,Data Engineer,iDerive,Remote,,fulltime,yearly,140000.0,100000.0,https://www.indeed.com/viewjob?jk=30eaf690c65a84a2,"Job Description: As a Data Engineer, you will be responsible for designing, implementing, and managing data pipelines using dbt (Data Build Tool), Python, and data partner APIs. You will collaborate closely with cross-functional teams, including Product, Data Science, Tableau developers, and other data engineers to gather requirements, retrieve data, and create an elegant, scalable data architecture for answering a variety of questions. You will work independently, with a high level of autonomy, and take ownership of end-to-end data engineering projects. Responsibilities: Design, develop, and maintain scalable and efficient data pipelines using dbt, Python, and other ETL tools. Extract, transform, and load (ETL) data from various sources into the data warehouse, ensuring data quality and consistency. Develop data pipelines and schemas from scratch, ensuring scalability, reusability, integrity, reliability, and performance. Collaborate with data scientists, analysts, and software engineers to understand data requirements and implement solutions that meet business needs. Monitor and troubleshoot data pipeline issues, ensuring data availability and reliability. Implement and maintain data governance policies, including data security, privacy, and compliance. Develop and maintain documentation related to data pipelines, data models, and data transformation processes. Stay up-to-date with the latest trends and technologies in data engineering and recommend improvements to enhance efficiency and effectiveness. Requirements: Bachelor’s degree in Computer Science, Engineering, or a related field (or equivalent experience). Strong experience in building and maintaining data pipelines using dbt. Proficiency in Python programming and experience with Linux environments. Demonstrated experience in designing and implementing data warehouses from scratch, ensuring performance and scalability. Strong understanding of SQL and database management systems. Familiarity with data modeling concepts and dimensional modeling techniques. Excellent problem-solving and troubleshooting skills, with the ability to work independently and proactively. Strong communication skills and ability to collaborate effectively with cross-functional teams. Tableau dashboard development experience is a plus. Job Type: Full-time Pay: $100,000.00 - $140,000.00 per year Benefits: 401(k) Dental insurance Flexible schedule Flexible spending account Health insurance Compensation package: Stock options Yearly pay Experience level: 2 years Schedule: 8 hour shift Choose your own hours Monday to Friday Application Question(s): Must answer to be considered: When using dbt, what command do you run to execute the pipelines and run all tests? Experience: dbt: 1 year (Required) SQL: 2 years (Required) Python: 1 year (Required) Work Location: Remote"
