site,title,company_name,city,state,job_type,interval,min_amount,max_amount,job_url,description
indeed,Full Stack Developer,Priority Wire & Cable Inc,Little Rock,AR,fulltime,,,,https://www.indeed.com/viewjob?jk=dfb551c40c4c2f2f,"About us Priority Wire & Cable (PWC) is a leading supplier of electrical, electronic and utility wire and cable products. PWC has 19 distribution centers located throughout the United States and in Toronto, Canada with 2.7 million square feet holding over $520,000,000+ in inventory. Job Overview Priority Wire & Cable has an immediate need for a Sr. Software Engineer to work in the Little Rock, AR area. We will consider candidates outside of Little Rock that work hybrid and periodically travel to Little Rock. The Sr. Software Engineer will work both independently and with leadership to ensure the success of software development projects including, but not limited to, assisting with establishing project scope and expectations, participating in code reviews, and managing support requests related to supported applications. Performs work under minimal supervision. Handles complex issues and problems, and refers only the most complex issues to higher-level staff. Possesses comprehensive knowledge of subject matter. Provides leadership, coaching, and/or mentoring to the team. May act as a lead or first-level supervisor. The ideal candidate will have a minimum of 7+ years of experience with PHP, SQL, Javascript, CSS, Linux and various other development tools and programs. The candidate will be joining a growing IT team and must be able to support and troubleshoot the production environment and provide remote and local support of developed applications to other offices. Duties & Responsibilities: Some of your duties may include: Develop and implement web applications using PHP, Microsoft SQL Server, MySQL, Javascript, CSS, and Symfony framework (PHP) Responsible for all phases of the Software Development Life Cycle (SDLC), gathering project requirements, analysis of hardware/software requirements, design forms and reports, database modifications, unit testing, user support, and maintenance Strong communication with technical and non-technical users, including senior management Demonstrated skills in: Experience with PHP Experience with writing ETL jobs, complex SQL queries, views, and stored procedures Excellent communication and documentation skills Strong problem-solving skills and ability to troubleshoot intermediate/complex software problems Highly motivated and efficient Extremely well organized Able to work under minimal supervision, manage own daily schedule, and prioritize activities Experience mentoring and training less experienced team members Experience setting standards for the team Experience with Apache and Linux environments Experience with IIS Experience with Linux process and job management Experience in CI (Continuous Integration) and CD (Continuous Deployment) in the development process with GIT for versioning and source code management Experience with reporting Experience with workflow or document imaging solutions such as DocuWare Experience with PowerBI Experience with iOS application programming Experience with Rest API Minimum Requirements and Qualifications: Bachelors degree in Computer Science, Information Systems, related field or equivalent experience 7+ years of programming experience in PHP Preferred: At least 1 year of experience with PHP Frameworks (Symfony is preferred) Previous Wire & Cable experience is a plus Multiple ERP platform experience Perks and Benefits at Priority Wire and Cable: Competitive salary Medical Insurance with premiums paid at 100% for employee AND dependents Dental Insurance 100% paid for Employee Vision Insurance HSA with Employer Contributions Life Insurance Short Term Disability 401(k) Plan Profit Sharing: Typical annual contribution of 15% of total eligible compensation Paid Holidays and PTO Cancer, Critical Illness and Accident Policies available Requirements: Candidates must be 18 years or older with the ability to understand and adhere to all job requirements and safety guidelines. Priority Wire and Cable is an Equal Opportunity Employer to include women, minorities, veterans, persons with disabilities, color, sex, sexual orientation, gender identity, religion, origin, and genetic information. If you are an individual with disabilities who needs accommodation or you are having difficulty using our website to apply for employment, please contact recruiting at 501-372-0019. This contact information is for accommodation requests only. Job Type: Full-time Benefits: 401(k) Dental insurance Employee assistance program Health insurance Health savings account Life insurance Paid time off Referral program Vision insurance Schedule: Monday to Friday Education: Bachelor's (Preferred) Experience: PHP programming: 7 years (Required) Work Location: Hybrid remote in Little Rock, AR 72206"
indeed,Senior Software Engineer,CliniComp,San Diego,CA,fulltime,,,,https://www.indeed.com/viewjob?jk=a9657114d4e195be,"About CliniComp Human centered. Technology driven. CliniComp, Intl. offers an architecture framework that can solve the problems of adaptability, scalability, reliability, and real-time performance within a complete EHR offering. The culmination of almost 40 years of continuous innovation, CliniComp’s solution represents the latest advancement of a modern web-based system within a single coherent distributable database facilitating standardized communication between systems. Job Description The Senior Software Engineer is responsible for providing software design, implementation, and testing of clinical information software used in healthcare institutions to chart review and analyze patient clinical data. This position performs software design based on input from the design team and clinical users, characteristics of the existing software base, in consultation with other engineering staff, and system functional requirements. *Please note this position requires you to be in our San Diego, CA office on a hybrid schedule* Requirements Job Responsibilities Perform software design based on input from clinical users, characteristics of the existing software base, consultation with other engineering staff, and system functional requirements. Perform software implementation, following coding guidelines and taking into account system characteristics to produce optimal performance, reliability, and maintainability. Conduct software evaluation and testing of own software, software from other engineering staff, and third-party software. Provide a test plan for use by other engineering staff, quality assurance and support departments in validating a new implementation. Provide technical documentation for the design, implementation and testing of the software. Attend design review meetings as needed to adhere to the software development procedures; enhance professional growth and development through participation in educational programs, current literature, in-service meetings and workshops. Assist the engineering staff in clarifying requests for software changes and understand reported problems. Performs other special projects, duties or changed duties as needed or directed. Minimum Qualifications: Bachelor’s degree in Mathematics, Computer Science or engineering-related discipline 10+ years software engineering experience with a solid understanding of software development and coding 5+ years’ experience with JavaScript, Linux systems and relational databases. Experience with React Experience with DBMS and SQL such as MySQL, SQLite, Oracle or other relational/NoSQL databases required Knowledge of software development lifecycle methodologies. Experience with debugging utilities such as GDB, etc Preferred Qualifications: Agile Software Methodologies C/C++ Typescript Material UI (MUI) Airflow Kafka Python PHP ExtJS Benefits The base salary range for this full-time position is $149,132 - $184,735. CliniComp's salary ranges are benchmarked and are determined by role and level. The range displayed on each job posting reflects the minimum and maximum target for new hire salaries for the position across all US locations and could be higher or lower based on a multitude of factors, including job-related skills, experience, location and relevant education or training. 100% covered Medical and Dental coverage for you & your family Generous 401(k) plan and contribution Events and weekly lunches Engaging wellness activities Corporate Social Responsibility Program So many more to list… CCI complies with the Americans with Disabilities Act and considers reasonable accommodation measures that may be necessary for eligible applicants/employees to perform primary responsibilities. EEO/AA/M/F/Veteran/Disabled."
indeed,Firmware Engineer,Neptune Technology Group,Duluth,GA,fulltime,,,,https://www.indeed.com/viewjob?jk=b60dcd5753afe5ef,"Are you interested in a unique opportunity to work on cutting-edge and innovative products of tomorrow, with a team of engineers with similar passion and open to creative thinking? Neptune Technology Group Inc. is a technology company serving water utilities across North America. Since 1892, we have continually focused on the evolving needs of water utilities – revenue optimization, operational efficiencies, and improved customer service. With our portfolio of smart water meters, data collection systems and software, we make data actionable for our customers – so they can remain focused on the business of water. For additional information, please visit the company website at www.neptunetg.com. Position SummaryThe Firmware Engineer II is responsible for the design, development, and implementation of new products as well as engineering support for existing products. This individual performs product design and works as a team member with R&E, Marketing, and Manufacturing for new products while complying with project schedules and budgets. Key Qualifications: Excellent C/C++ programming skills with experience in embedded system design and development Extensive experience in debugging embedded systems Experience with embedded firmware development tools such oscilloscopes, spectrum analyzers, DC power analyzers, logic analyzers, and protocol analyzers Experience with designing and developing RF products for public and proprietary networks Experience with ARM Cortex-A7/A8/A9 processors Experience with ARM Cortex-M3/M4/M33, 8051, and MSP430 microcontrollers Experience with Keil, IAR or equivalent IDEs/compilers Knowledge of wireless communication techniques and associated protocols such as LoRaWAN, Bluetooth Smart (BLE), cellular communication (LTE) Familiarity with low power design practices for battery powered devices Familiarity with serial communication protocols such as UART, SPI, I2C Familiarity with security-related aspects and best practices associated with embedded system development including cryptographic algorithms, authentication protocols, secure boot, ARM TrustZone, etc. Ability to read and understand hardware schematics Experience with JIRA or other issue tracking software Experience with TeamCity or other continuous integration platforms Experience working in an Agile development environment (Scrum/XP) Experience with unit testing and unit testing frameworks/tools such as CppUTest and Unity Excellent documentation practices and communication skills Commitment to maintaining project schedules and delivering tasks on time Preferred Qualifications: Embedded Linux and Yocto experience Linux/Unix shell scripting (SH, BASH, etc.) Python 3 Docker Knowledge of networking connectivity protocols such as TCP/IP, FTP, MQTT Experience with agency certifications such FCC, Industry Canada, and cellular carrier certifications Requirements: Education: Bachelor of Science degree in Electrical Engineering, Wireless Engineering, or Computer Engineering Experience: 1-3 years in Engineering product design and development or 0-1 years with a Master of Science degree. 1-2 years of embedded C programming Travel: Up to 10% Location: Duluth, Georgia or Tallassee, Alabama #HP1 Equal Opportunity Employer EEO/AA M/F/Vet Disability Job Type: Full-time Benefits: 401(k) matching Dental insurance Employee discount Flexible schedule Flexible spending account Health insurance Health savings account Life insurance Paid time off Professional development assistance Referral program Relocation assistance Tuition reimbursement Vision insurance Schedule: Monday to Friday Ability to commute/relocate: Duluth, GA 30096: Reliably commute or planning to relocate before starting work (Required) Work Location: Hybrid remote in Duluth, GA 30096"
indeed,Software Engineer,Peraton,Blacksburg,VA,fulltime,yearly,82000.0,51000.0,https://www.indeed.com/viewjob?jk=9b0a36ec7d1b2cc6,"Responsibilities: Peraton is seeking Entry-Level Software Engineers to join our Technology and Engineering Software Delivery Center in Blacksburg, VA. The ideal candidate will support exciting projects across Peraton in areas such as communications, space, cybersecurity, defense, health, and mobile. As an entry-level Software Engineer, you’ll have the opportunity to work in a collaborative, supportive environment that allows you to grow your skills and your career while building experience in a variety of different projects and domains. You’ll work in an Agile software development environment supporting requirements/story development, software architecture and design, software development, and unit/component testing. Responsibilities: Design, develop, and test leading edge technology solutions in areas such as cybersecurity, satellite ground systems, information management systems, cloud computing, and mobility. Work in a collaborative, team-oriented Agile software development environment to help shape the direction of the project. Support the software engineering life-cycle in areas such as requirements/story development, software architecture and design, software development, and unit/component testing. Qualifications: Required Qualifications: U.S. Citizenship and the ability to obtain and maintain a security clearance. Bachelor’s degree in computer science, computer engineering, software engineering or a related field. December 2023 and May/June 2024 grads are welcome to apply. 0-2+ years of experience working as a software engineer. Experience programming in Java or a similar language and a solid foundation in object-oriented development. Strong analytical and problem-solving skills. Ability to quickly adapt and learn new technologies and concepts. Self-motivated, independent, detail oriented, responsible team-player. Strong written and oral communication skills. Desired Qualifications: 3.0 and above GPA. Prior work or educational experience working in an Agile software development environment. Experience with web development frameworks, database technologies, web services, and/or web application servers. Experience with integrated development environment and configuration/build management tools and processes. Experience with deploying software into cloud environments, particularly Amazon Web Services, using technologies such as Ansible, Docker, and Rancher. Location: Blacksburg, VA Peraton Overview: Peraton drives missions of consequence spanning the globe and extending to the farthest reaches of the galaxy. As the world’s leading mission capability integrator and transformative enterprise IT provider, we deliver trusted and highly differentiated national security solutions and technologies that keep people safe and secure. Peraton serves as a valued partner to essential government agencies across the intelligence, space, cyber, defense, civilian, health, and state and local markets. Every day, our employees do the can’t be done, solving the most daunting challenges facing our customers. Target Salary Range: $51,000 - $82,000. This represents the typical salary range for this position based on experience and other factors. EEO: An Equal Opportunity Employer including Disability/Veteran."
indeed,Senior Software Engineer,"The Travelers Companies, Inc.",Hartford,CT,,yearly,182300.0,110500.0,https://www.indeed.com/viewjob?jk=c0e148f4950d9f38,"Who Are We? Taking care of our customers, our communities and each other. That’s the Travelers Promise. By honoring this commitment, we have maintained our reputation as one of the best property casualty insurers in the industry for over 160 years. Join us to discover a culture that is rooted in innovation and thrives on collaboration. Imagine loving what you do and where you do it. Compensation Overview The annual base salary range provided for this position is a nationwide market range and represents a broad range of salaries for this role across the country. The actual salary for this position will be determined by a number of factors, including the scope, complexity and location of the role; the skills, education, training, credentials and experience of the candidate; and other conditions of employment. As part of our comprehensive compensation and benefits program, employees are also eligible for performance-based cash incentive awards. Salary Range $110,500.00 - $182,300.00 Target Openings 1 What Is the Opportunity? Travelers is seeking a Software Engineer II to join our organization as we grow and transform our Technology landscape. Individual will complete advanced end to end engineering tasks for specific system assignments including designing, developing, analyzing, configuring, testing, debugging, troubleshooting, documenting, health monitoring/alerting, and implementing based on user or system specifications, consulting with users to determine hardware, software or system functional specifications, managing interaction between the systems and other technical support areas and defining technical requirements and coordinating team resources to solve problems. This position is for a Software Engineer II who will develop applications in AWS for Enterprise Payments and Billing. The position will involve learning, developing and supporting applications using distributed and event-driven technologies. What Will You Do? Perform analysis, design, development, and configuration functions (includes defining technical requirements) with a high degree of accuracy and speed, operating as an individual contributor to team goals. Perform analysis, assessment and resolution for defects and incidents of advanced complexity and escalate appropriately. Work independently to tackle well-scoped and loosely scoped problems. Seek opportunities to expand technical knowledge and capabilities. Provide technical guidance and mentorship to less experienced employees. Perform other duties as assigned. What Will Our Ideal Candidate Have? Four years of programming/development experience preferred. Experience building applications in the public cloud (preferably AWS) Experience in writing cloud native compute functions / Lambdas using Python / Node.js Experience building REST APIs & developing API contracts Experience in Postgres and in noSQL databases Build and deploy applications using CI/CD pipeline Experience using Github, SonarQube & BlackDuck Excellent verbal and written communication skills Interest to learn new technology & design patterns and to cross-train, collaborate and share knowledge with others in the team Domain knowledge & experience in P&C Insurance, Payments & Billing systems Experience building applications using Angular Delivery - Intermediate delivery skills including the ability to estimate accurate timelines for tasks and deliver work at a steady, predictable pace to achieve commitments, contribute to the software design strategy and methodologies used to best meet the system requirements, consider and build for many different use cases, avoid over engineering, and ensure automation, deliver complete solutions but release them in small batches, and identify important tradeoffs and negotiate them. Domain Expertise - Demonstrated track record of domain expertise including understanding technical concepts necessary to do the job effectively and aware of industry trends, demonstrate willingness, cooperation, and concern for business issues and priorities, and possess in depth knowledge of immediate systems worked on and some knowledge of adjacent systems. Problem Solving - Strong problem solver who ensures solutions are built for the long term, is able to resolve new issues, recognizes mistakes using them as learning and teaching opportunities and consistently breaks down large problems into smaller, more manageable ones. Communication - Strong communicator who possesses the ability to articulate information clearly and concisely with the business, document work in a clear, easy to follow manner, collaborate well with team members as both a mentor and mentee, take in vague requirements and ask the right questions to ensure clarification, offer feedback appropriately and effectively, seek out and receives constructive criticism well, listen when others are speaking and make space for colleagues to share their thoughts. Leadership - Intermediate leadership skills with the ability to help create a safe environment for others to learn and grow as engineers and a proven track record of self-motivation in identifying opportunities and tracking team efforts. What is a Must Have? Bachelor’s degree or its equivalent in work experience. Two years of programming/development experience. What Is in It for You? Health Insurance: Employees and their eligible family members – including spouses, domestic partners, and children – are eligible for coverage from the first day of employment. Retirement: Travelers matches your 401(k) contributions dollar-for-dollar up to your first 5% of eligible pay, subject to an annual maximum. If you have student loan debt, you can enroll in the Paying it Forward Savings Program. When you make a payment toward your student loan, Travelers will make an annual contribution into your 401(k) account. You are also eligible for a Pension Plan that is 100% funded by Travelers. Paid Time Off: Start your career at Travelers with a minimum of 20 days Paid Time Off annually, plus nine paid company Holidays. Wellness Program: The Travelers wellness program is comprised of tools and resources that empower you to achieve your wellness goals. In addition, our Life Balance program provides access to professional counseling services, life coaching and other resources to support your daily life needs. Through Life Balance, you’re eligible for five free counseling sessions with a licensed therapist. Volunteer Encouragement: We have a deep commitment to the communities we serve and encourage our employees to get involved. Travelers has a Matching Gift and Volunteer Rewards program that enables you to give back to the charity of your choice. Employment Practices Travelers is an equal opportunity employer. We believe that we can deliver the very best products and services when our workforce reflects the diverse customers and communities we serve. We are committed to recruiting, retaining and developing the diverse talent of all of our employees and fostering an inclusive workplace, where we celebrate differences, promote belonging, and work together to deliver extraordinary results. If you are a candidate and have specific questions regarding the physical requirements of this role, please send us an email so we may assist you. Travelers reserves the right to fill this position at a level above or below the level included in this posting. To learn more about our comprehensive benefit programs please visit http://careers.travelers.com/life-at-travelers/benefits/. 0"
