site,title,company_name,city,state,job_type,interval,min_amount,max_amount,job_url,description
indeed,Software Engineer,"General Dynamics Mission Systems, Inc",Bloomington,MN,fulltime,yearly,122000.0,110108.0,https://www.indeed.com/viewjob?jk=8def2a4d8ff85216,"Basic Qualifications : Requires a Bachelor’s degree in Software Engineering, or a related Science, Engineering or Mathematics field. Also requires 5+ years of job-related experience, or a Master's degree plus 3 years of job-related experience. Agile experience preferred. CLEARANCE REQUIREMENTS: Ability to obtain a Department of Defense Secret security clearance is required at time of hire. Applicants selected will be subject to a U.S. Government security investigation and must meet eligibility requirements for access to classified information. Due to the nature of work performed within our facilities, U.S. citizenship is required. Responsibilities for this Position: ROLE AND POSITION OBJECTIVES: As a software engineer for Land & Airborne Systems, you’ll be a member of a cross functional team responsible for developing and testing embedded systems, products, and services that make a real difference in keeping our heroes and nation safe. We encourage you to apply if you have any of these preferred skills or experiences: Advanced proficiency in C/C++ and python Solid knowledge of Linux Experience developing software on embedded systems (Application, Bare-metal, or RTOS) What sets you apart: Ability to lead the software development process Expertise in applying technical standards and methodologies to solve challenges in creative ways Collaborative team player eager to provide technical leadership and positioning others for success Thorough knowledge of technology trends and willingness to champion new ideas and process improvements Commitment to ongoing professional development for yourself and others Our Commitment to You: An exciting career path with opportunities for continuous learning and development. Research oriented work, alongside award winning teams developing practical solutions for our nation’s security Flexible schedules with every other Friday off work, if desired (9/80 schedule) Competitive benefits, including 401k matching, flex time off, paid parental leave, healthcare benefits, health & wellness programs, employee resource and social groups, and more See more at gdmissionsystems.com/careers/why-work-for-us/benefits Workplace Options: This position is expected to be largely on-site, with Hybrid/Flex options. While on-site, you will be a part of the Bloomington, MN engineering team. #LI-Hybrid Salary Note: This estimate represents the typical salary range for this position based on experience and other factors (geographic location, etc.). Actual pay may vary. Combined Salary Range: USD $110,108.00 - USD $122,000.00 /Yr. Company Overview: At General Dynamics Mission Systems, we rise to the challenge each day to ensure the safety of those that lead, serve, and protect the world we live in. We do this by making the world’s most advanced defense platforms even smarter. Our engineers redefine what’s possible and our manufacturing team brings it to life, building the brains behind the brawn on submarines, ships, combat vehicles, aircraft, satellites, and other advanced systems. We pride ourselves in being a great place to work with this shared sense of purpose, committed to a diverse and exciting employee experience that drives innovation and creates a community where all feel welcome and a part of something amazing. We offer highly competitive benefits and a flexible work environment where contributions are recognized and rewarded. To see more about our benefits, visit https://gdmissionsystems.com/careers/why-work-for-us/benefits General Dynamics is an Equal Opportunity/Affirmative Action Employer that is committed to hiring a diverse and talented workforce. EOE/Disability/Veteran"
indeed,Senior Software Engineer,Que Technology Group,Fort Meade,MD,fulltime,,,,https://www.indeed.com/viewjob?jk=6f91db1dd1fce4d7,"*** Only candidates with current TS/SCI clearance will be considered *** ** We are unable to sponsor a clearance at this time *** _________________________________________________________________________________________ JOB DESCRIPTION: Develop, maintain, and enhance complex and diverse software systems (e.g., processing-intensive analytics, novel algorithm development, manipulation of extremely large data sets, real-time systems, and business management information systems) based upon documented requirements Work individually or as part of a team Review and test software components for adherence to the design requirements and documents test results. Resolve software problem reports. Utilize software development and software design methodologies appropriate to the development environment. Provide specific input to the software components of system design to include hardware/software trade-offs, software reuse, use of Commercial Off-the-shelf (COTS) in place of new development, and requirements analysis and synthesis from system level to individual software components ​C++ and Python development position working with various RF applications for SDR solutions​ REQUIRED SKILLS: Analyze user requirements to derive software design and performance requirements Debug existing software and correct defects Provide recommendations for improving documentation and software development process standards Design and code new software or modify existing software to add new features Integrate existing software into new or modified systems or operating environments Develop simple data queries for existing or proposed databases or data repositories Write or review software and system documentation Serve as team lead at the level appropriate to the software development process being used on any particular project Design or implement complex database or data repository interfaces/queries Develop or implement algorithms to meet or exceed system performance and functional standards Assist with developing and executing test procedures for software components Develop software solutions by analyzing system performance standards, confer with users or system engineers; analyze systems flow, data usage and work processes; and investigate problem areas Modify existing software to correct errors, to adapt to new hardware, or to improve its performance Design, develop and modify software systems, using scientific analysis and mathematical models to predict and measure outcome and consequences of design Design or implement complex algorithms requiring adherence to strict timing, system resource, or interface constraints Perform quality control on team products Implement recommendations for improving documentation and software development process standards Oversee one or more software development teams and ensure the work is completed in accordance with the constraints of the software development process being used on any particular project Confer with system engineers and hardware engineers to derive software requirements and to obtain information on project limitations and capabilities, performance requirements and interfaces Coordinate software system installation and monitor equipment functioning to ensure operational specifications are met EDUCATION AND EXPERIENCE: Bachelor's degree in Computer Science or related discipline from an accredited college or university is required. Four (4) years of additional SWE experience on projects with similar software processes may be substituted for a bachelor's degree Fourteen (14) years' experience as a SWE in programs and contracts of similar scope, type, and complexity is required ** You must have TS/SCI Clearance for this position ** BENEFITS: Competitive salary Employer-paid health care 100% (CareFirst – Medical, Dental, and Vision) 401k Safe Harbor Plan – 6% match – Immediately vested 25 days personal time off 11 Federal Holidays Up to 3 Employer Paid Code Red Days (due to weather, shutdown, etc.) $5,000 per year for Training/Personal Development Employer-paid Short-Term Disability/Long Term Disability/Life Insurance/AD&D We are an equal opportunity employer, and all qualified applicants will receive consideration for employment without regard to race, color, religion, sex, sexual orientation, gender identity or expression, pregnancy, age, national origin, disability status, genetic information, protected veteran status, or any other characteristic protected by law. Job Type: Full-time Schedule: 8 hour shift Monday to Friday License/Certification: TS/SCI clearance with polygraph? (Required) Security clearance: Top Secret (Required) Work Location: In person"
indeed,Full Stack Developer,Priority Wire & Cable Inc,Little Rock,AR,fulltime,,,,https://www.indeed.com/viewjob?jk=dfb551c40c4c2f2f,"About us Priority Wire & Cable (PWC) is a leading supplier of electrical, electronic and utility wire and cable products. PWC has 19 distribution centers located throughout the United States and in Toronto, Canada with 2.7 million square feet holding over $520,000,000+ in inventory. Job Overview Priority Wire & Cable has an immediate need for a Sr. Software Engineer to work in the Little Rock, AR area. We will consider candidates outside of Little Rock that work hybrid and periodically travel to Little Rock. The Sr. Software Engineer will work both independently and with leadership to ensure the success of software development projects including, but not limited to, assisting with establishing project scope and expectations, participating in code reviews, and managing support requests related to supported applications. Performs work under minimal supervision. Handles complex issues and problems, and refers only the most complex issues to higher-level staff. Possesses comprehensive knowledge of subject matter. Provides leadership, coaching, and/or mentoring to the team. May act as a lead or first-level supervisor. The ideal candidate will have a minimum of 7+ years of experience with PHP, SQL, Javascript, CSS, Linux and various other development tools and programs. The candidate will be joining a growing IT team and must be able to support and troubleshoot the production environment and provide remote and local support of developed applications to other offices. Duties & Responsibilities: Some of your duties may include: Develop and implement web applications using PHP, Microsoft SQL Server, MySQL, Javascript, CSS, and Symfony framework (PHP) Responsible for all phases of the Software Development Life Cycle (SDLC), gathering project requirements, analysis of hardware/software requirements, design forms and reports, database modifications, unit testing, user support, and maintenance Strong communication with technical and non-technical users, including senior management Demonstrated skills in: Experience with PHP Experience with writing ETL jobs, complex SQL queries, views, and stored procedures Excellent communication and documentation skills Strong problem-solving skills and ability to troubleshoot intermediate/complex software problems Highly motivated and efficient Extremely well organized Able to work under minimal supervision, manage own daily schedule, and prioritize activities Experience mentoring and training less experienced team members Experience setting standards for the team Experience with Apache and Linux environments Experience with IIS Experience with Linux process and job management Experience in CI (Continuous Integration) and CD (Continuous Deployment) in the development process with GIT for versioning and source code management Experience with reporting Experience with workflow or document imaging solutions such as DocuWare Experience with PowerBI Experience with iOS application programming Experience with Rest API Minimum Requirements and Qualifications: Bachelors degree in Computer Science, Information Systems, related field or equivalent experience 7+ years of programming experience in PHP Preferred: At least 1 year of experience with PHP Frameworks (Symfony is preferred) Previous Wire & Cable experience is a plus Multiple ERP platform experience Perks and Benefits at Priority Wire and Cable: Competitive salary Medical Insurance with premiums paid at 100% for employee AND dependents Dental Insurance 100% paid for Employee Vision Insurance HSA with Employer Contributions Life Insurance Short Term Disability 401(k) Plan Profit Sharing: Typical annual contribution of 15% of total eligible compensation Paid Holidays and PTO Cancer, Critical Illness and Accident Policies available Requirements: Candidates must be 18 years or older with the ability to understand and adhere to all job requirements and safety guidelines. Priority Wire and Cable is an Equal Opportunity Employer to include women, minorities, veterans, persons with disabilities, color, sex, sexual orientation, gender identity, religion, origin, and genetic information. If you are an individual with disabilities who needs accommodation or you are having difficulty using our website to apply for employment, please contact recruiting at 501-372-0019. This contact information is for accommodation requests only. Job Type: Full-time Benefits: 401(k) Dental insurance Employee assistance program Health insurance Health savings account Life insurance Paid time off Referral program Vision insurance Schedule: Monday to Friday Education: Bachelor's (Preferred) Experience: PHP programming: 7 years (Required) Work Location: Hybrid remote in Little Rock, AR 72206"
indeed,Software Engineer,Johns Hopkins Applied Physics Laboratory (APL),Laurel,MD,,,,,https://www.indeed.com/viewjob?jk=c0b9b91433fcacb0,"Description Are you a software engineer with experience in DevSecOps that wants to have impact on nationally important defense programs using innovation and technology to solve technical challenges? Do you want a key software engineering role that helps AMDS overcome the Grand Challenges of Defending Theater Forces, Defending the Seams, and Defending the Homeland? Do you want to help transform Command and Control (C2) for the U.S. Military in direct support of overcoming those Grand Challenges? Would you like to contribute to the design, implementation, and integration of modern infrastructure architecture and automation principles vital to realize DevSecOps to prototype and transition containerized military Mission Planning tools and Battle Management Aids to U.S. warfighters? If so, we're looking for someone like you to join our team at APL. We are seeking an experienced Software Engineer with DevSecOps expertise, including cybersecurity requirements, cloud-native (i.e., Kubernetes) and containerized applications. As a member of our team, you will contribute to the A3K Group Mission to ""develop, prototype, and transition military mission planning tools and battle management aids to maximize the warfighters’ ability to configure/optimize military systems in the field encompassing multiple simultaneous air and missile defense missions, multiple services, and multiple command echelon planning levels."" You will focus that contribution on enhancing software engineering to develop and deploy cloud-native applications that meet cybersecurity requirements for installation and use in both JHUAPL and government host environments. As a Software Engineer with a focus in DevSecOps you will... Engineer infrastructure solutions to execute continuous integration, testing, and delivery (CI/CD) pipelines Deploy secure, cloud-native applications at various classification levels leveraging Commercial off the Shelf (COTS), Government off the Shelf (GOTS), and open-source components Contribute to security, supportability, and scalability of applications Identify and resolve infrastructure issues Automate configuration management, testing, and deployments Track and document changes to infrastructure as code (IaC) using configuration management tools Perform continuous vulnerability scanning and help ensure cybersecurity compliance Leverage tools like Jira, Gitlab, Bitbucket, and Confluence to track development activities, control source code, and author design, architecture, and supporting (configuration and troubleshooting) documentation Provide software engineering thought leadership and expertise necessary for modern software development of planning, battle management aid, and coordination systems and tools Collaborate closely with application developers, management, government partners, and Information Technology (IT) to understand and implement DevSecOps infrastructure needs Support and consistently demonstrate the APL Core Values: https://www.jhuapl.edu/culture/core-values Qualifications You meet our minimum qualifications for the job if you... Possess a Bachelor’s degree in Software Engineering, Computer Engineering, Computer Science, Information Systems Engineering, or equivalent Have a strong background in Linux/Unix Have familiarity with micro-service, cloud-native, and federated architecture technologies, setup/configuration, and optimization Have strong Information Technology (IT) skills and an ability to rapidly learn and deploy new technologies Have experience with tools for Continuous Integration/Continuous Delivery, Software Version Control, and Build Automation such as Git, Gitlab, and Tekton Have familiarity with package management software (container registries, rpm, yum, conda, or similar) Have 2 years of scripting experience Have 2 or more years of experience with Kubernetes and containerization Have 2 or more years of experience with infrastructure as code (IaC) tools (Puppet, Ansible, or equivalent) Have strong problem solving, analytical and organizational skills Demonstrate strong verbal and written communication skills Have proven success working in a multi-disciplinary team environment Demonstrated success in working in an engineering team of 3 or more people Possess a Secret security clearance. If selected, you will be subject to a government security clearance investigation and must meet the requirements for access to classified information. Eligibility requirements include U.S. citizenship. You'll go above and beyond our minimum requirements if you... Possess an advanced degree (Master’s degree or PhD degree) in Software Engineering, Computer Engineering, Computer Science, Information Systems Engineering, or equivalent Possess CompTIA Security+ Certification or equivalent Experience with hardening applications for compliance with DoD cybersecurity requirements Experience with configuring on-premises information systems Have 4 years of scripting experience (e.g., Python, Bash, SQL, or similar) Have 4 or more years of experience with Kubernetes (OpenShift) and containerization Have 4 or more years of experience with infrastructure as code (IaC) tools (Puppet, Ansible, or equivalent) Demonstrated success in working in an engineering team of 10 or more people Have technical expertise in the deployment and operation of DoD systems Hold an active Final Secret security clearance with the ability to obtain a Top Secret Security Clearance Why work at APL? The Johns Hopkins University Applied Physics Laboratory (APL) brings world-class expertise to our nation’s most critical defense, security, space and science challenges. While we are dedicated to solving complex challenges and pioneering new technologies, what makes us truly outstanding is our culture. We offer a vibrant, welcoming atmosphere where you can bring your authentic self to work, continue to grow, and build strong connections with inspiring teammates. At APL, we celebrate our differences and encourage creativity and bold, new ideas. Our employees enjoy generous benefits, including a robust education assistance program, unparalleled retirement contributions, and a healthy work/life balance. APL’s campus is located in the Baltimore-Washington metro area. Learn more about our career opportunities at http://www.jhuapl.edu/careers. #LI-KW1 About Us APL is an Equal Opportunity/Affirmative Action employer. All qualified applicants will receive consideration for employment without regard to race, creed, color, religion, sex, gender identity or expression, sexual orientation, national origin, age, physical or mental disability, genetic information, veteran status, occupation, marital or familial status, political opinion, personal appearance, or any other characteristic protected by applicable law. APL is committed to promoting an innovative environment that embraces diversity, encourages creativity, and supports inclusion of new ideas. In doing so, we are committed to providing reasonable accommodation to individuals of all abilities, including those with disabilities. If you require a reasonable accommodation to participate in any part of the hiring process, please contact Accommodations@jhuapl.edu. Only by ensuring that everyone’s voice is heard are we empowered to be bold, do great things, and make the world a better place."
indeed,Software Engineer,Peraton,Blacksburg,VA,fulltime,yearly,82000.0,51000.0,https://www.indeed.com/viewjob?jk=9b0a36ec7d1b2cc6,"Responsibilities: Peraton is seeking Entry-Level Software Engineers to join our Technology and Engineering Software Delivery Center in Blacksburg, VA. The ideal candidate will support exciting projects across Peraton in areas such as communications, space, cybersecurity, defense, health, and mobile. As an entry-level Software Engineer, you’ll have the opportunity to work in a collaborative, supportive environment that allows you to grow your skills and your career while building experience in a variety of different projects and domains. You’ll work in an Agile software development environment supporting requirements/story development, software architecture and design, software development, and unit/component testing. Responsibilities: Design, develop, and test leading edge technology solutions in areas such as cybersecurity, satellite ground systems, information management systems, cloud computing, and mobility. Work in a collaborative, team-oriented Agile software development environment to help shape the direction of the project. Support the software engineering life-cycle in areas such as requirements/story development, software architecture and design, software development, and unit/component testing. Qualifications: Required Qualifications: U.S. Citizenship and the ability to obtain and maintain a security clearance. Bachelor’s degree in computer science, computer engineering, software engineering or a related field. December 2023 and May/June 2024 grads are welcome to apply. 0-2+ years of experience working as a software engineer. Experience programming in Java or a similar language and a solid foundation in object-oriented development. Strong analytical and problem-solving skills. Ability to quickly adapt and learn new technologies and concepts. Self-motivated, independent, detail oriented, responsible team-player. Strong written and oral communication skills. Desired Qualifications: 3.0 and above GPA. Prior work or educational experience working in an Agile software development environment. Experience with web development frameworks, database technologies, web services, and/or web application servers. Experience with integrated development environment and configuration/build management tools and processes. Experience with deploying software into cloud environments, particularly Amazon Web Services, using technologies such as Ansible, Docker, and Rancher. Location: Blacksburg, VA Peraton Overview: Peraton drives missions of consequence spanning the globe and extending to the farthest reaches of the galaxy. As the world’s leading mission capability integrator and transformative enterprise IT provider, we deliver trusted and highly differentiated national security solutions and technologies that keep people safe and secure. Peraton serves as a valued partner to essential government agencies across the intelligence, space, cyber, defense, civilian, health, and state and local markets. Every day, our employees do the can’t be done, solving the most daunting challenges facing our customers. Target Salary Range: $51,000 - $82,000. This represents the typical salary range for this position based on experience and other factors. EEO: An Equal Opportunity Employer including Disability/Veteran."
